doi,title,pdf_path,route,ready_for_step6_text,paper_type,mentions_ibuprofen,mentions_diffusion_cell,franz_confirmed,where_diffusion_cell,where_franz,study_type,barrier_category,barrier_name_raw,endpoint_qfinal_found,endpoint_time_found,where_endpoint,figure_only,endpoint_carrier,endpoint_carrier_where,endpoint_carrier_snippet,formulation_carrier,formulation_carrier_where,formulation_carrier_snippet,endpoint_likely_in_supp,formulation_table_missing,notes
10.3390/ijms242115632,Enhancing Transdermal Delivery: Investigating the Impact of Permeation Promoters on Ibuprofen Release and Penetration from Medical Patches-In Vitro Research.,GenAI\papers\pdf\10.3390_ijms242115632__cc885c7871.pdf,text,yes,primary_experiment,yes,yes,uncertain,Methods Section,Methods Section,IVPT,skin,pig skin,yes,yes,Table 6,no,table_text,Table 6,Table 6 summarizes the cumulative mass of IBU followed by an analysis of the skin permeation parameters.,table_text,Table 7,Table 7 shows the appropriate weights with which to prepare the formulation.,no,no,Study focuses on different formulations of ibuprofen in transdermal patches and analyzes their permeation through skin.
10.3390/membranes12080762,In Situ Generation of Fouling Resistant Ag/Pd Modified PES Membranes for Treatment of Pharmaceutical Wastewater.,GenAI\papers\pdf\10.3390_membranes12080762__fa6875b6e1.pdf,text,yes,primary_experiment,yes,yes,no,Figure 2,unknown,IVRT,uncertain,PES membranes with Ag/Pd nanoparticles,yes,yes,Table 3,no,table_text,"Table 3 shows water contact angles, fluxes, porosity, zeta potential, mean pore radius, and salt rejection properties of the Ag/Pd PES membranes. The table shows numerical rejection values for ibuprofen.","The rejection of organic compounds was also investigated, with Table 3 detailing the rejection percentages for ibuprofen along with cumulative permeability data.",table_text,Table 1 conveys the composition of the PES casting solutions used for membrane fabrication.,Table 1 presents the formulations of the casting solutions including Ag/Pd concentrations for the membrane.,no,no,
10.3390/nano10112165,Embedding Ordered Mesoporous Carbons into Thermosensitive Hydrogels: A Cutting-Edge Strategy to Vehiculate a Cargo and Control Its Release Profile.,GenAI\papers\pdf\10.3390_nano10112165__6748e42f34.pdf,text,yes,primary_experiment,yes,yes,yes,"Section 2.6, Ibuprofen Release from Hybrid Sol-Gel Systems","Section 2.6, Ibuprofen Release from Hybrid Sol-Gel Systems",IVPT,both,"Ordered Mesoporous Carbons, Thermosensitive Hydrogels",yes,yes,"Section 3.1.2, Ibuprofen Loading into C1 and C3 Carbons",no,narrative,"Section 3.1.2, Ibuprofen Loading into C1 and C3 Carbons","""the total mass of the drug loaded C3 and C1 decreased by approximately 50% of the initial weight, in agreement with the 1:1 initial loading""",table_text,"Table 1, Compositional information and acronyms of the formulations","""Table 1. Compositional information and acronyms of the formulations designed in this work""",no,no,
10.3390/pharmaceutics12020151,Evaluation of Formulation Parameters on Permeation of Ibuprofen from Topical Formulations Using Strat-M<sup>®</sup> Membrane.,GenAI\papers\pdf\10.3390_pharmaceutics12020151__701029bf55.pdf,text,yes,primary_experiment,yes,yes,no,PAGE 3,unknown,IVPT,synthetic_membrane,Strat-M® membrane,yes,yes,PAGE 1,no,table_text,"PAGE 6, Table 5",Cumulative amount of drug permeated at the end of 24 h was highest for clear gel (3% w/w ibuprofen; F6: 739.6 ± 36.1 µg/cm2)...,table_text,"PAGE 6, Table 2",Composition of ibuprofen emulgel (F5) (3% w/w) is provided in Table 2.,no,no,
10.3390/pharmaceutics13111952,Polyelectrolyte-Coated Mesoporous Bioactive Glasses via Layer-by-Layer Deposition for Sustained Co-Delivery of Therapeutic Ions and Drugs.,GenAI\papers\pdf\10.3390_pharmaceutics13111952__45146cae8a.pdf,text,yes,primary_experiment,yes,yes,no,Not explicitly detailed in document,Not applicable,IVPT,both,Cu-substituted MBG nanoparticles,yes,yes,"Results section, Table 1",no,table_text,Table 2,"Table 2 shows the weight loss percentages associated with each deposited layer and ibuprofen loading, indicating the cumulative release results.",supplement,Supplementary Information,Ibuprofen was loaded into Cu_SG_CAC and Cu_SG_CIC via specific methods detailed in the supplementary material.,yes,no,Details on specific time points and measurement methods present.
10.3390/pharmaceutics2020209,A Comparative Study of Transmembrane Diffusion and Permeation of Ibuprofen across Synthetic Membranes Using Franz Diffusion Cells.,GenAI\papers\pdf\10.3390_pharmaceutics2020209__1a2e9fadde.pdf,text,yes,primary_experiment,yes,yes,yes,PAGE 2,PAGE 4,IVPT,synthetic_membrane,Synthetic membranes (13 types) listed in Table 1,yes,yes,PAGE 8,no,table_text,"PAGE 8, Table 3","Table 3. Summary of average ibuprofen flux from saturated solution (n = 6), total diffusion after 6 h and the coefficient of variation (CV) for individual synthetic membranes.",table_text,"PAGE 6, Table 2",Table 2. A mass balance result (at 60 ºC) for ibuprofen saturated solution.,no,no,Study investigates ibuprofen diffusion using various synthetic membranes in Franz diffusion cells; comprehensive quantitative results provided.
10.3390/polym15040791,"Chitin-Glucan Complex Hydrogels: Physical-Chemical Characterization, Stability, In Vitro Drug Permeation, and Biological Assessment in Primary Cells.",GenAI\papers\pdf\10.3390_polym15040791__a37a825452.pdf,text,yes,primary_experiment,yes,yes,yes,2.9. In Vitro Drug Permeation Studies,2.9. In Vitro Drug Permeation Studies,IVPT,skin,Strat-M membranes,yes,yes,Table 2,no,table_text,Table 2 shows the drug loading (DL) and entrapment efficiency (EE) values for ibuprofen.,Table 2 shows that sodium ibuprofen loading led to a drug loading of 11.25 ± 2.04 mg/cm3 and an entrapment efficiency of 14.43 ± 0.88%.,table_text,Table 1 provides data on the chemical characterization and properties of the hydrogels containing ibuprofen.,"Table 1 summarizes the compressive modulus, toughness, and other properties of the Na51*4 and Na51*6 hydrogels.",no,no,
10.3390/polym16142006,Cellulose Acetate and Polycaprolactone Fibre Coatings on Medical-Grade Metal Substrates for Controlled Drug Release.,GenAI\papers\pdf\10.3390_polym16142006__02ac8ba9aa.pdf,text,yes,primary_experiment,yes,yes,no,Section 2.2.4 (Drug Release Methodology) explains drug release methodology in a simulated body fluid that could imply diffusion cell usage.,unknown,IVPT,both,"medical-grade stainless steel, cellulose acetate, polycaprolactone",yes,yes,Table 1,no,table_text,Table 1 presents the estimated drug released in SBF or water for each membrane studied.,Table 1. Estimated drug released in SBF or water for each membrane studied...,table_text,Table 1 shows the Ibu released (mg) for different membranes.,Table 1. Estimated drug released in SBF or water for each membrane studied...,no,no,The study examines the drug release behavior of Ibu embedded in polymer membranes.
